{
  "$schema": "https://json-schema.org/draft/2020-12/schema",
  "$id": "https://lealing.dev/schemas/marketplace-entry-v1.json",
  "title": "Lealing marketplace entry v1",
  "type": "object",
  "additionalProperties": false,
  "required": [
    "id", "version", "name", "summary", "category", "risk", "permissions",
    "publisher", "manifestUrl", "artifacts", "protocol", "minimumEngine", "channel"
  ],
  "properties": {
    "id": {"type": "string", "pattern": "^[a-z0-9]+(?:-[a-z0-9]+)*$"},
    "version": {"type": "string", "pattern": "^[0-9]+\\.[0-9]+\\.[0-9]+(?:-[0-9A-Za-z.-]+)?$"},
    "name": {"type": "string", "minLength": 1},
    "summary": {"type": "string", "pattern": "^[^\\r\\n]+\\.$"},
    "detail": {"type": "string"},
    "category": {"enum": ["system", "ai", "network", "media", "dev", "utilities"]},
    "risk": {"enum": ["safe", "caution", "destructive"]},
    "glyph": {"type": "string"},
    "permissions": {
      "type": "object",
      "additionalProperties": false,
      "required": ["filesystem", "network", "subprocess"],
      "properties": {
        "filesystem": {
          "type": "object",
          "additionalProperties": false,
          "required": ["read", "write"],
          "properties": {
            "read": {"type": "array", "items": {"type": "string", "minLength": 1}, "uniqueItems": true},
            "write": {"type": "array", "items": {"type": "string", "minLength": 1}, "uniqueItems": true}
          }
        },
        "network": {"type": "boolean"},
        "subprocess": {"type": "boolean"}
      }
    },
    "publisher": {"type": "string", "minLength": 1},
    "manifestUrl": {"type": "string", "format": "uri", "pattern": "^https://"},
    "artifacts": {
      "type": "array",
      "minItems": 1,
      "items": {
        "type": "object",
        "additionalProperties": false,
        "required": ["platform", "url", "sha256"],
        "properties": {
          "platform": {"enum": ["darwin-amd64", "darwin-arm64", "windows-amd64", "windows-arm64"]},
          "url": {"type": "string", "format": "uri", "pattern": "^https://"},
          "sha256": {"type": "string", "pattern": "^[0-9a-fA-F]{64}$"}
        }
      }
    },
    "protocol": {
      "type": "object",
      "additionalProperties": false,
      "required": ["min", "max"],
      "properties": {
        "min": {"type": "integer", "minimum": 1},
        "max": {"type": "integer", "minimum": 1}
      }
    },
    "minimumEngine": {"type": "string", "pattern": "^[0-9]+\\.[0-9]+\\.[0-9]+(?:-[0-9A-Za-z.-]+)?$"},
    "channel": {"enum": ["official", "verified", "community"]}
  }
}
