{
  "id": "cidr-calculator",
  "version": "1.3.0",
  "name": "Calculadora CIDR",
  "summary": "Calcule rede, faixa, broadcast e capacidade de blocos IPv4 ou IPv6.",
  "detail": "Normaliza o bloco e calcula máscara, primeiro e último endereço e quantidade total.",
  "category": "network",
  "risk": "safe",
  "glyph": "▦",
  "permissions": {
    "filesystem": {
      "read": [],
      "write": []
    },
    "network": false,
    "subprocess": false
  },
  "publisher": "mateuslh",
  "manifestUrl": "https://github.com/mateuslh/lealing-tools/releases/download/v1.3.0/cidr-calculator_manifest.yaml",
  "artifacts": [
    {
      "platform": "darwin-amd64",
      "url": "https://github.com/mateuslh/lealing-tools/releases/download/v1.3.0/cidr-calculator_darwin_amd64.tar.gz",
      "sha256": "6fbca58eaf73ba694501ffb16b8dd9921acc8fba12c15b1b89f31cb688cc3c44"
    },
    {
      "platform": "darwin-arm64",
      "url": "https://github.com/mateuslh/lealing-tools/releases/download/v1.3.0/cidr-calculator_darwin_arm64.tar.gz",
      "sha256": "7e676c65a1023b32b3c09aeed4d85ac3a3e2bb47c08211804404e99ff5cc9fa7"
    },
    {
      "platform": "windows-amd64",
      "url": "https://github.com/mateuslh/lealing-tools/releases/download/v1.3.0/cidr-calculator_windows_amd64.zip",
      "sha256": "d0a73eea6201defa4a50bce99908ea6c8eb6a8210408e1486bba83b6bcdfd78a"
    },
    {
      "platform": "windows-arm64",
      "url": "https://github.com/mateuslh/lealing-tools/releases/download/v1.3.0/cidr-calculator_windows_arm64.zip",
      "sha256": "c281214f936c9e638eadaf91339ca8627efccc9578698610f86c046907a01a04"
    }
  ],
  "protocol": {
    "max": 1,
    "min": 1
  },
  "minimumEngine": "0.3.1",
  "channel": "official"
}
