{
  "id": "uuid-generator",
  "version": "1.3.3",
  "name": "Gerador de UUID",
  "summary": "Gere lotes de UUID v4 criptograficamente aleatórios ou UUID v7 ordenáveis.",
  "detail": "Usa crypto/rand e oferece UUID v4 aleatório ou UUID v7 ordenável por timestamp.",
  "category": "dev",
  "risk": "safe",
  "glyph": "✣",
  "permissions": {
    "filesystem": {
      "read": [],
      "write": []
    },
    "network": false,
    "subprocess": false
  },
  "publisher": "mateuslh",
  "manifestUrl": "https://github.com/mateuslh/lealing-tools/releases/download/v1.3.3/uuid-generator_manifest.yaml",
  "artifacts": [
    {
      "platform": "darwin-amd64",
      "url": "https://github.com/mateuslh/lealing-tools/releases/download/v1.3.3/uuid-generator_darwin_amd64.tar.gz",
      "sha256": "408860820edf73795d8c0814e6ae40886ae6fa3b7a6045f3a0a3e245a441e70a"
    },
    {
      "platform": "darwin-arm64",
      "url": "https://github.com/mateuslh/lealing-tools/releases/download/v1.3.3/uuid-generator_darwin_arm64.tar.gz",
      "sha256": "74de7fbb973aa0df3770b38e03f31be5890df83c3f3f90b3fb1bc6ca45256a83"
    },
    {
      "platform": "windows-amd64",
      "url": "https://github.com/mateuslh/lealing-tools/releases/download/v1.3.3/uuid-generator_windows_amd64.zip",
      "sha256": "a233dd29c173e802e193c9943128c5604e18c358b6227c047b246714ad06f550"
    },
    {
      "platform": "windows-arm64",
      "url": "https://github.com/mateuslh/lealing-tools/releases/download/v1.3.3/uuid-generator_windows_arm64.zip",
      "sha256": "c4818825b51210b1992d07a090d73dd2e102a4bffccd27297613cd0b1dbb733a"
    }
  ],
  "protocol": {
    "max": 1,
    "min": 1
  },
  "minimumEngine": "0.3.1",
  "channel": "official"
}
