{
  "id": "http-probe",
  "version": "1.3.0",
  "name": "Sonda HTTP",
  "summary": "Inspecione status, latência, headers e uma prévia segura de uma URL.",
  "detail": "Executa GET ou HEAD com timeout, limite de corpo e redirecionamentos controlados.",
  "category": "network",
  "risk": "safe",
  "glyph": "↗",
  "permissions": {
    "filesystem": {
      "read": [],
      "write": []
    },
    "network": true,
    "subprocess": false
  },
  "publisher": "mateuslh",
  "manifestUrl": "https://github.com/mateuslh/lealing-tools/releases/download/v1.3.0/http-probe_manifest.yaml",
  "artifacts": [
    {
      "platform": "darwin-amd64",
      "url": "https://github.com/mateuslh/lealing-tools/releases/download/v1.3.0/http-probe_darwin_amd64.tar.gz",
      "sha256": "5f6e5be8b27a7161a4b8ccec06386b0d28431cfbceabea01a394767cdcec309d"
    },
    {
      "platform": "darwin-arm64",
      "url": "https://github.com/mateuslh/lealing-tools/releases/download/v1.3.0/http-probe_darwin_arm64.tar.gz",
      "sha256": "9654b8f55a4cf6f46819286f3f5eeeeb2b930f96c39b94c257950634f61ce401"
    },
    {
      "platform": "windows-amd64",
      "url": "https://github.com/mateuslh/lealing-tools/releases/download/v1.3.0/http-probe_windows_amd64.zip",
      "sha256": "7fb7abc4db646c134c8e3a4dbe082ad8b8b22b36e7bceb49f8a92a262f4ef80c"
    },
    {
      "platform": "windows-arm64",
      "url": "https://github.com/mateuslh/lealing-tools/releases/download/v1.3.0/http-probe_windows_arm64.zip",
      "sha256": "3c02dc6e72396dcff61ec111f8650b9adc9771ba357e39aef0167a352006ae07"
    }
  ],
  "protocol": {
    "max": 1,
    "min": 1
  },
  "minimumEngine": "0.3.1",
  "channel": "official"
}
