{
  "id": "network-inspector",
  "version": "1.3.3",
  "name": "Inspetor DNS e TLS",
  "summary": "Resolva DNS ou examine validade, emissor e nomes de um certificado TLS.",
  "detail": "Resolve endereços e nomes canônicos ou abre uma conexão somente para ler o certificado apresentado.",
  "category": "network",
  "risk": "safe",
  "glyph": "◎",
  "permissions": {
    "filesystem": {
      "read": [],
      "write": []
    },
    "network": true,
    "subprocess": false
  },
  "publisher": "mateuslh",
  "manifestUrl": "https://github.com/mateuslh/lealing-tools/releases/download/v1.3.3/network-inspector_manifest.yaml",
  "artifacts": [
    {
      "platform": "darwin-amd64",
      "url": "https://github.com/mateuslh/lealing-tools/releases/download/v1.3.3/network-inspector_darwin_amd64.tar.gz",
      "sha256": "132bbc8ee6afe7baff86cf85535ae0e817ab8d519fb73f9d2e2bee62eca7a77b"
    },
    {
      "platform": "darwin-arm64",
      "url": "https://github.com/mateuslh/lealing-tools/releases/download/v1.3.3/network-inspector_darwin_arm64.tar.gz",
      "sha256": "316f4a7ef413d71ab932b27a58fbff31e1dc2f39f2d09eab044f66bb87d4eec3"
    },
    {
      "platform": "windows-amd64",
      "url": "https://github.com/mateuslh/lealing-tools/releases/download/v1.3.3/network-inspector_windows_amd64.zip",
      "sha256": "3fef31a32839c899629b0eeb8303d4e20f80dc40ca4bad21323ef5510f2db129"
    },
    {
      "platform": "windows-arm64",
      "url": "https://github.com/mateuslh/lealing-tools/releases/download/v1.3.3/network-inspector_windows_arm64.zip",
      "sha256": "e8a5fbe0e6781155adde5a4c66ddafc374bca3bb7c8a691a8ef3b1155e36a2a5"
    }
  ],
  "protocol": {
    "max": 1,
    "min": 1
  },
  "minimumEngine": "0.3.1",
  "channel": "official"
}
