{
  "id": "codec-lab",
  "version": "1.3.0",
  "name": "Codecs Base64 e URL",
  "summary": "Codifique e decodifique Base64, Base64URL e componentes de URL.",
  "detail": "Transforma texto localmente sem executar nem interpretar a saída como comando.",
  "category": "dev",
  "risk": "safe",
  "glyph": "⇄",
  "permissions": {
    "filesystem": {
      "read": [],
      "write": []
    },
    "network": false,
    "subprocess": false
  },
  "publisher": "mateuslh",
  "manifestUrl": "https://github.com/mateuslh/lealing-tools/releases/download/v1.3.0/codec-lab_manifest.yaml",
  "artifacts": [
    {
      "platform": "darwin-amd64",
      "url": "https://github.com/mateuslh/lealing-tools/releases/download/v1.3.0/codec-lab_darwin_amd64.tar.gz",
      "sha256": "921571ee9f446646145b6c354d3136e6dd89f6e314f8b732640bfd08f2504a5e"
    },
    {
      "platform": "darwin-arm64",
      "url": "https://github.com/mateuslh/lealing-tools/releases/download/v1.3.0/codec-lab_darwin_arm64.tar.gz",
      "sha256": "83d26a6392f26e8985b8bd208698624f319c0534c7a35b11ddd925e9b14b49a9"
    },
    {
      "platform": "windows-amd64",
      "url": "https://github.com/mateuslh/lealing-tools/releases/download/v1.3.0/codec-lab_windows_amd64.zip",
      "sha256": "a699a1a42e857ccacbc28c0d2ac2e772261d24d4bd13cc5bd391e1b4c3ecc4bc"
    },
    {
      "platform": "windows-arm64",
      "url": "https://github.com/mateuslh/lealing-tools/releases/download/v1.3.0/codec-lab_windows_arm64.zip",
      "sha256": "fc80a7f16cbe780ecc5adeb9c0bb0ec6ef4c578cf29644cde03157c9cbe8a00f"
    }
  ],
  "protocol": {
    "max": 1,
    "min": 1
  },
  "minimumEngine": "0.3.1",
  "channel": "official"
}
