{
  "id": "jwt-inspector",
  "version": "1.1.0",
  "name": "Inspetor JWT",
  "summary": "Decodifique header, claims e validade temporal de um JWT sem enviar o token.",
  "detail": "Decodifica Base64URL e apresenta os campos do token sem prometer verificação de assinatura.",
  "category": "dev",
  "risk": "safe",
  "glyph": "◈",
  "permissions": {
    "filesystem": {
      "read": [],
      "write": []
    },
    "network": false,
    "subprocess": false
  },
  "publisher": "mateuslh",
  "manifestUrl": "https://github.com/mateuslh/lealing-tools/releases/download/v1.1.0/jwt-inspector_manifest.yaml",
  "artifacts": [
    {
      "platform": "darwin-amd64",
      "url": "https://github.com/mateuslh/lealing-tools/releases/download/v1.1.0/jwt-inspector_darwin_amd64.tar.gz",
      "sha256": "a8609147e19bb4548c8ca625b99c09c76c6f260e2989b8f3831bdfc2e2bf28a6"
    },
    {
      "platform": "darwin-arm64",
      "url": "https://github.com/mateuslh/lealing-tools/releases/download/v1.1.0/jwt-inspector_darwin_arm64.tar.gz",
      "sha256": "2f4bee84d73cbba88eae85ea66a43e5efe9869b03e6e847fe03cd06388190981"
    },
    {
      "platform": "windows-amd64",
      "url": "https://github.com/mateuslh/lealing-tools/releases/download/v1.1.0/jwt-inspector_windows_amd64.zip",
      "sha256": "13a9e86addd08d22485973d953396874c3bee7a96586680cdecf0baf86c21965"
    },
    {
      "platform": "windows-arm64",
      "url": "https://github.com/mateuslh/lealing-tools/releases/download/v1.1.0/jwt-inspector_windows_arm64.zip",
      "sha256": "832502bb8a938cf85ac961bec9b165ca417b843e8fe1de69224ba99672eaa16b"
    }
  ],
  "protocol": {
    "max": 1,
    "min": 1
  },
  "minimumEngine": "0.3.1",
  "channel": "official"
}
