{
  "id": "claude-accounts",
  "version": "1.3.3",
  "name": "Contas do Claude Code",
  "summary": "Guarde várias contas do Claude Code inteiras e alterne explicitamente entre elas.",
  "detail": "Cada perfil guarda a conta completa — credencial, identidade, cotas e o settings.json inteiro, com endpoint, modelos e variáveis. Histórico, planos e tarefas ficam de fora e continuam de onde pararam.",
  "category": "ai",
  "risk": "caution",
  "glyph": "⇆",
  "permissions": {
    "filesystem": {
      "read": [
        "~/.claude/.credentials.json",
        "~/.claude/settings.json",
        "~/.claude.json"
      ],
      "write": [
        "~/.claude/.credentials.json",
        "~/.claude/settings.json",
        "~/.claude.json"
      ]
    },
    "network": false,
    "subprocess": true
  },
  "publisher": "mateuslh",
  "manifestUrl": "https://github.com/mateuslh/lealing-tools/releases/download/v1.3.3/claude-accounts_manifest.yaml",
  "artifacts": [
    {
      "platform": "darwin-amd64",
      "url": "https://github.com/mateuslh/lealing-tools/releases/download/v1.3.3/claude-accounts_darwin_amd64.tar.gz",
      "sha256": "2d8a0ae77a3c9c01e26cf513026a2301885d14c20316fb2aeb622f16447fbd4f"
    },
    {
      "platform": "darwin-arm64",
      "url": "https://github.com/mateuslh/lealing-tools/releases/download/v1.3.3/claude-accounts_darwin_arm64.tar.gz",
      "sha256": "21b785cf6d913c9c9d33fc8d673a5126a186220f65b12076fc80d37f3b62b9a3"
    },
    {
      "platform": "windows-amd64",
      "url": "https://github.com/mateuslh/lealing-tools/releases/download/v1.3.3/claude-accounts_windows_amd64.zip",
      "sha256": "552ee76b82f10713bbcecdac5b9a9c49cf17a328150d725286c44c7c6b0640ec"
    },
    {
      "platform": "windows-arm64",
      "url": "https://github.com/mateuslh/lealing-tools/releases/download/v1.3.3/claude-accounts_windows_arm64.zip",
      "sha256": "68a820f7ca33df061a1589508aa021fef69fa3250862671ffc8026f492915339"
    }
  ],
  "protocol": {
    "max": 1,
    "min": 1
  },
  "minimumEngine": "0.3.1",
  "channel": "official"
}
